	id	sentence1	sentence2	is_duplicate
191973	a7f8d025ee5638456ad4f1da5	What are some fun things teens can do in the summer?	What are some fun things to do in the summer as a teenager?	1.0
273569	f33f30678fc28c8a82e81fb79	How do you stop your period once it has started?	Can I stop my period once it starts?	1.0
215207	3c08156939197c5bc99f27cb6	Why is Saltwater taffy candy imported in The Bahamas?	Why is Saltwater taffy candy imported in Switzerland?	1.0
145454	a90004609032e8747b8d595e4	Do Quora users still see questions that are marked as needing improvement?	Do people see questions that are marked as needing improvement?	1.0
269341	e32619bbc4669dc3dec1cea43	Why is transformer rated in kVA and not in kW?	What is real, reactive, and apparent power?	0.0
337756	75880b99bf491e0711bc350a2	What does it feel like to be fired from Google?	Has anyone been fired from Google?	1.0
171527	9f3db7a102ca74d171c791971	What should I do about this little girl having a crush on me?	What should I do about my crush on this guy?	0.0
141883	f3b55ec46cb422ec4f8fb8959	Where can I get list of stylish collection of designer floor tiles in Sydney?	Where can I get amazing collection of floor tiles in Sydney?	1.0
121787	f84a61d74d17ad2844a551b00	How do I learn advanced SQL?	What is the best way to learn advance sql?	1.0
163239	7089ded1756cef8d47014bcbd	What is the story behind the alleged affair of SRK and Priyanka Chopra?	How is Priyanka Chopra as a person in real life?	0.0
74084	a4b01726f2ea81f6d449923c2	Do you think the most likely 28th Amendment should involve education?	What are the most likely candidates to be the 28th Amendment to the Constitution?	0.0
277998	be23ae9297e9f857cb2864504	What is a way to make money online?	What is the easy way to make money online?	1.0
372248	af2924ddf93481ba350a61905	What are the best software tools for structural engineers?	What are some of the best companies for structural engineers?	0.0
251168	dc24f2285094a489c3a171e51	How does a person learn how to hack?	How do you learn about hacking?	1.0
247318	4d4efbc5b31e25c82c5f8c17f	What would be effect of 500 and 1000 Rs notes ban?	What are your views on the ban of Rs 500 and Rs 1000 notes by the Indian Government? Pros cons?	1.0
401250	c49e60d4536457e78f4cea65c	"""Can the statement """"X is n times less or smaller than Y be justified when n>1?"""	For any [math]A_{n\times n}[/math], is it possible to show that [math]A^{-1}[/math] is unique?	0.0
114494	339039c28d5ab35c29ba86400	How can a foreign Web developer find work in Dubai?	What is the average salary for an IT professional in Dubai?	0.0
384469	e41be4636f5afd218d716f8a1	Why acceleration due to gravity is zero at center?	Is acceleration due to gravity an absolute constant?	0.0
151650	768d0a6d45acd6be124c9f158	What are some mind blowing bike gadgets and technologies that most people should have?	What are some mind blowing car gadgets that most people should have?	0.0
83712	7ddeb00eb6c485c541aa8ba17	Is there any difference between faith and belief?	In a religious context, what is the difference between belief and faith?	1.0
144892	9852e67eabc5f472937f39136	Which is a good inpatient drug and alcohol rehab center near Hamilton County FL?	What is a good inpatient drug and alcohol rehab center near Leon County FL?	0.0
382857	48b59efb308bfd93657233246	Why is my period 11 days late and how probable is it that I'm pregnant?	My period is late 14 days, could I be pregnant?	1.0
271224	f5905b3b0d2ac129fe8c533fc	What are the best road trips that can be done in India?	What are the best road trip destinations in India?	1.0
100103	b6cd447745220646eec17562a	How do you plot your novels?	How do I develop my plot into a novel?	1.0
265780	fbd808623ebece283932c4eb6	What is your greatest regret in life?	What are the biggest regrets of your life?	1.0
57026	057cb72b6a5698cb1492162f8	How is the word 'defile' used in a sentence?	How is the word 'taciturn' used in a sentence?	0.0
143628	5438ef630cf0f0361217ab036	Has anyone used keenmobi.com?	Has anyone used Centurica.com?	0.0
210616	63b3273590a317989f8c1580d	Computers: Why does my screen go black while watching Netflix?	How do I zoom out on my computer screen?	0.0
378972	59620791c0a60081c746d9bae	What are the advantages of black tea?	What are the disadvantage of black tea?	0.0
8095	f753d37bbd46bb01b33644b1f	Where can I get Painting services in Brisbane?	Where can I get expert house painting service in Brisbane?	0.0
171907	8757bd6e4e54466ee666c7661	Is helicopter parenting a trend?	Will the pendulum move from helicopter parenting to free-range parenting soon?	1.0
105679	927dd1327f1a6f8d996598a4a	Medicine and Healthcare: How can I prevent a stroke?	What are the best possible methods to prevent stroke?	1.0
180151	f6dda42f2ba93332bdd7866a4	What is the difference between computer science and information science?	What's the difference between computer science and information science engineering?	0.0
218934	37c09bbf9f29e7dc48a87dd3f	Is Disney contractually allowed to remake the Star Wars prequels?	Would it be possible for the Star Wars prequels to be successfully remade by Disney?	0.0
41549	a7181d5491298e0b3ec563eb3	New-York Season 2 online watch?	How can I hack WiFi using a command prompt?	0.0
198049	5631cc74d6537f64ff2b414a9	How can you learn street dance?	What is the best way to learn to dance?	0.0
245008	f7b0d531cefbde37446301b79	What are the uses of Arduino?	What is the software used in Arduino?	0.0
336649	707610416d336e618a38a4a95	Fascists: Why are you a fascist and how did you come to be one?	What are some helpful suggestions to make using computers easier for someone who is going blind and has shaky hands?	0.0
155909	65a68e450339e4e13f23008e6	What are the 2 best lines of poetry or Shayari?	What is the best 2 line Shayari?	1.0
324209	7a9ba616aee97035b9495b027	Has anyone ever gotten excited to do something but can't get themselves to actually do it?	What is Freud’s explanation of love ?	0.0
96030	a46365d688cd61f2a102cd2d2	What is the fastest way to learn how to cook?	What are the best ways to learn to cook?	1.0
335412	cfa87fcfac38f16a1dc50a3e4	Why do some people think that the Earth is flat when it is very clear that it is not?	Why do some people still think the Earth is flat?	1.0
93426	49fa2602820460dbc5236c6a3	Who's better: Metallica or Slipknot?	Why is Megadeth better than Metallica?	0.0
104443	fdc03fd7c712cac9dd0a5e418	What would Planet 9 be like?	What is Planet X?	0.0
322466	fd498f01230a33fad2706332a	How do you accept yourself as gay?	How can you accept yourself as gay?	1.0
299140	1fad1f38e10f0199de245c638	Which are the best books for iit jam mathematics?	What are the best books for preparing for the IIT JAM Maths exam?	1.0
203294	7eca5b585ab7eec2016572e97	What is the best selling book of 2015?	What are the best selling books of 2015 in the field of spirituality?	0.0
217482	1f09e635887e7bc6f638f6991	What did Dhoni step down as ODI and T20 captain so quietly?	Why did MS Dhoni steps down as captain of India limited overs side?	1.0
236955	cd2e51189f30af2ece022482c	What are some things new employees should know going into their first day at Xerox?	What are some things new employees should know going into their first day at Target?	0.0
5493	85d27b395484615cfcba2f4e1	What are the best online courses for digital marketing?	Which are the courses on Coursera or other MOOCs to study digital marketing?	1.0
279066	d9c5ef6404b7abed8d50ceedc	What are some of the funniest questions asked on Quora?	What are some funniest questions ever asked on Quora?	1.0
354526	59be046eccd237352185044d7	Can we play PES 2016 offline?	Has anyone played PES 2015 on PC?	0.0
308634	10f702b62844c9ccea653d1ef	How can you cook a cucumber?	Can you cook cucumber?	0.0
314972	5489edbeb4a7132e049944629	What is the solution of Kashmir problem?	What is the best political solution to the Kashmir conflict?	1.0
171041	e277944670c770e80cf616c76	How do I learn not to care about what people think of me?	As an individual, do I really need to care what people think about me?	1.0
388345	fb2f121977954f67a8428df97	Does ulcerative colitis cause an enlarged spleen?	What is ulcerative colitis?	0.0
160939	752e2042be398c2ed2cf942af	How do I become a Technical Applications specialist?	How do I become a Squarespace Specialist?	0.0
82964	2722810144114b26f9a0fb2f3	How can I unfollow everyone I'm following on Instagram?	How do I know who I follow that do not follow me back on Instagram?	0.0
168616	94f48e892f3f82ec50e6562af	Do we need smart cities or smart politicians?	Do we need smart cities or smart laws?	0.0
314487	8307952a7c423778e338d64c8	In the film La La Land, does Ryan Gosling actually play any of the instruments?	Did Ryan Gosling learn to play piano for La La Land?	1.0
310339	5b4e4c775959026f618613beb	What would be the economic impact of a Swadeshi movement if India were to adopt it in today's economic crisis?	What is the economic slowdown in India?	0.0
249928	184029d6c0123a97e30c06956	What's so special about Tamil writer Jayakanthan's novels?	Who is your favourite Tamil writer?	0.0
4044	cab5d1f665743b48c13746202	Given access to the same facts, how is it possible that there can be disagreement between experts in a discipline?	Given access to the same facts, how is it possible that there can be disagreement between experts in a discipline? What are two examples for it?	0.0
89616	edaed7d822a77ba52df709404	Why doesn't edX provide an archive of their forums that would be available to anyone?	Why doesn't Coursera provide an archive of their forums that would be available to anyone?	0.0
279536	602cbd7e728c26dd25455a8f8	What are some mind-blowing gadgets for cars that exist in 2016 that most people don't know about?	What are the most advanced car gadgets that people don't know about yet?	1.0
175166	5d37dbab5db23d0034432ab01	What is the best way to learn web programming?	How can I learn web programming from home free and effectively?	1.0
314777	09d768a2624ab64987552b459	What is the difference between regular expression and regular grammar?	What is the difference between a*|b* and (a|b) * in regular expressions?	0.0
141371	1c8ac0a945939310fc7d01afa	What does population density mean?	What do you believe to be strong examples of consciousness evolving throughout the past 5,000 years?	0.0
339733	dd113f22abf763487c011811e	What is the best way to spend a weekend if you don't have a girlfriend?	How do you all spend your weekends (students)?	0.0
353867	683e5afb4714d25da3ef51c1c	"""What should we learn from movie """"Dear Zindagi""""?"""	"""What can we learn from the movie """"Dear Zindagi""""?"""	1.0
251183	4dc12c7b075ec521277cedf9c	What are the differences between tempera and acrylic paint?	When would I use tempera paint over acrylic?	0.0
87368	d62ffd8023736f96c5519dcdc	What is outer space?	Is there up and down in outer space?	0.0
177585	667c49c7239683b0bc15b1403	How can I slowly lose weight?	I am ugly and fat, how to lose weight?	1.0
296658	47dc67c448522c503c8f0332b	How is the GATE paper pattern by IISc Bangalore different from the IITs for mechanical branch?	How is the GATE paper pattern by IISC Bangalore different from the IITs for the architecture and planning branch?	0.0
241019	2ac85a8fb951f818c73cecccd	What mobile analytics platforms are most similar to Appsee?	What is your experience with using Appsee?	0.0
81075	35c3c4ef71549bb450fbc3997	What are the documents required for a uneducated person if he doesn't have birth certificate?	Why is that Annexure A is not accepted by PSK as proof for someone who is born on 1957, illiterate and doesn't have Birth certificate?	0.0
307805	a04d7ce688a315a0a8d15d3e9	What are some of the best video games of all time?	What are the best skateboarding video games of all time?	0.0
307179	fcbf2d57e39948436306a859c	After getting otp how to generate pin for newly debit card of SBI?	What is the day-to-day procedure of NDA SSB? What are tips regarding dressing?	0.0
268718	e3653f74bc4719e85ee35ae7a	What can you do to delete an Ebates account?	How can I delete my Celtx account?	0.0
162453	b95578b3124677210ee120b5e	Game of Thrones: How did the faith of the seven, the most powerless of the gods, become so prevalent in the South?	Why is Game of Thrones the most pirated show today?	0.0
17273	22135f8ee6549dda100a9112d	Is 1100 a good psat score?	Is a 1290 on the new (2015/16) PSAT a good score?	0.0
149593	c4f3e87932b10d6f10526319d	Europe universities that accept the license degree in geography advantage acceptable addition to the grant?	What are the best online poker sites in Europe that will accept US players (who are physically located in Europe)?	0.0
142242	cccdfcc8929228c2e4c2b6c59	What is your age and salary?	What was your age and salary when you got in to your first job?	0.0
447	0839b2b3abae3c47c3e50f4ee	What are natural numbers?	What is a least natural number?	0.0
45495	4e073a2093fcf3d247f3165f3	What are Zomato's fundraising strategies?	What was Zomato's strategy for the first 12 months?	0.0
147114	6e8b1eab62c0de5ee1e6973ef	Which iPhone should I buy between iPhone 6 and 6S?	What is the difference between iPhone 6s and iPhone 6s Plus?	1.0
345942	564ccb7dfe2e734e90b9854b7	How do I speak English fluently at an interview?	How can I speak fluent English with accuracy?	1.0
157818	b695d80604c193c94e9d32c07	Do Italian men really flirt all the time?	What do Italian men like in a woman?	0.0
103390	7a11abd54e7c0e3fa7a23f79e	Is there going to be war against Russia?	Is there potential for a war with Russia?	1.0
63015	47ef3d2528a592585c467c902	What's it like to be rich as in 1% rich?	When did the 1% begin and what is it?	0.0
355024	893b469dff520f32db0037dc1	How do I work out without gaining weight?	How should I work out to gain weight?	0.0
9361	4d4fe7265ba04c4c8aa1cf058	How do you delete Pandora stations?	Where does Pandora get its lyrics from?	0.0
52168	3fe27165ddb3b9096a602480d	How do I ensure that I don't waste time on the Internet?	How do I stop wasting my time on the internet?	1.0
341341	717b8738a4c7e7221ad60a3ef	How do I score 305 and above in GRE within 15 days?	Are 15 days enough to get 305 in the GRE?	0.0
332876	919cb3ae8fab326b5007c7db7	What is the best lead generator?	What's best for the IT lead generation?	0.0
385470	282d6a9cbac9d3d60384492a2	How do I know whether my phone has LTE/4G support or not?	Does Reliance Jio 4G requires a LTE SIM Cards or VOLTE compatible Handset? Can we use data on current phone over a WiFi?	0.0
7192	f8c83c19d46cf40a0bbf1788e	Can Brahmins eat eggs?	Are there any practising Brahmins in Bollywood ?	0.0
94384	c37a2a4120a5a7cd8d1b26df4	How many songs have been made?	Why do so many people know song lyrics by heart?	0.0
133119	b10d777c4239d4f9a47544220	Why did Austria-Hungary annex Bosnia and Herzegovina?	What was Austria-Hungary in Hitler's childhood years like?	0.0
329920	c247bf67cea11b8fd5e3b1684	In Westworld, how is Lawrence (the Man in Black’s captive) able to remember the happenings of the previous episode (killing of his family)?	In Westworld, if all the hosts are pulled from the storyline at times to be fixed, doesn't it alter the storylines for all the guests in that time?	0.0
139102	773235cf75bbde86ace4f8084	What is a scholarship?	What is AISEE Scholarship?	0.0
30585	b0b6192c4b75c9a223b9316c3	Are Indian nuclear scientists really being murdered? Is the government of India investigating?	Why do most of India's nuclear scientists get murdered?	1.0
161007	567ccd22ad22ead387abf45eb	What is the meaning of the song Fireflies by Owl City?	Who is Mac Miller and Owl City?	0.0
350515	8d45341370ba7bf55b2b1fd16	What does it take to be a great math teacher?	How can I be a great math techer?	1.0
125285	d98bb367ae115fa89a694a764	What is the average yearly salary of an Operations Coordinator at Uber?	What does the job of an Operations Coordinator at Uber entail?	0.0
154953	f7c369d25ce1fdb2987cbfac2	How important are high school friends later on in life?	How important are high school friends in life?	1.0
382440	c335406ff9090c35add10525c	Which is the best geography book for UPSC?	Which is best book of geography for UPSC?	1.0
364952	6fb872edc80162d8cdbf39ef7	How many Gmail accounts can I create with one phone number?	Can I sign in to my Gmail account with phone number?	0.0
330405	486dd59238ac6fc180b92fa4f	How can I specifically improve my English?	What are some ways to improve English?	1.0
400769	3687b654e94f6c6cc5e5714c5	Why do men love boobs (irrespective of big or small)?	Why men love boobs?	1.0
32384	3a3ad52720728c22c14348e6b	Are donut holes really made from the hole of a donut?	What is a bismarck donut? How does it compare to other donuts?	0.0
55159	c95bccb707f078c1064ce1353	Are there any gymnastics TV shows?	What are the best gymnastics TV shows?	1.0
336891	412138371ddaa691ae22e974a	Why is sales force automation important?	What is sales force automation?	0.0
216568	aa844e71bee7af4013914d3e2	What are the best ways to lose weight?	What are the best ways to lose weight during school time?	0.0
168787	720dcc24b4e4b2a8241828caf	Is D5200 the best choice to shoot films and YouTube videos in 2016?	How do i find period of following functions?	0.0
347814	1ce458a51d05c09a0ef402a13	What are some references to tacos in popular culture?	What are some references to the Arctic in popular culture?	0.0
39386	7e87834d200d1208cad989813	How can I control my emotion and fears?	How do you control your emotions in public?	1.0
299545	4c763e87325bb3e5678f29b6f	What are the best places to visit in india with parents?	What are some of the best places in India to visit with friends?	0.0
60990	e9355c028cebd88ac616481c4	What is genetic drift?	What is genetic drift? What are some of the effects?	1.0
300041	d68f90a2609cb94305ac7b8e1	"""Why do people use TL;DR when """"abstract"""" or """"conclusion"""" already exists?"""	What is the TL;DR version of World War I?	0.0
177235	e1be57aacd5a8c8534d0971be	What are some good April Fool's Day jokes to play on your mom?	What are the best April Fools' day jokes of 2016?	0.0
129041	a80860aeb5882009229aedec2	"""My son plays Minecraft on the computer. The other day he was playing online and someone asked him """"d or t."""" What does this mean?"""	If I purchase Minecraft, does it mean that I have a premium account? Can I play online?	0.0
4830	817f9b65439798f0c75906f24	How can I make people want to be with me?	How do I make other people want to be around me?	1.0
315370	405cb37dbb92684f2a78a4e3a	Have you ever felt intense, deep, pulsating horniness at an inconvenient time?	Can our body absorb systemic enzymes through our skin?	0.0
320250	513f51aa4d91fc6afcef88ca4	Who is the best t-shirt manufacturer in Thailand?	How can I find a t-shirt manufacturer in Thailand?	0.0
201899	da83870f1f676bd79d089d299	What is Hillary Clinton's stance on Russia?	How will Hillary Clinton deal with russia?	1.0
205560	2b02cbf5f50afe47b24b1067f	How much time does it take to ship something First Class with USPS?	How much does a USPS tube for a poster cost?	0.0
90955	a1a6e8998ddea77d78c43c5a0	What's your biggest regret?	What is your biggest regret from when you were a kid?	0.0
142761	2d583fc0100c5352f0bce3ac0	Do Aghoris really have sex with dead bodies?	Can we bring life into a dead body?	0.0
333131	000b7582b4f2b8cc502d1e0ec	Why are you addicted to Quora?	Are you addicted to Quora?	0.0
214325	0b210d04eb3ebea3f35ea45eb	Why do people say Hillary Clinton is a crook?	Why do people think Hillary Clinton is corrupt?	1.0
196682	c3279a26a87502ca5a7ef4680	What phone should I buy under Rs 15000?	Which mobile I should buy under 15k?	1.0
26396	87a28a0481a3d78eca078452f	How is Newton's method used in the Engineering field in real life?	What is the use of limits in real life?	0.0
180235	cc64c690cf2b212480a5bf845	How can I improve my English reading comprehension?	How do I improve my reading comprehension in English more efficiently?	1.0
193639	e9edbddfc9f5dce57bbc09922	How does the sun always burn?	Will the sun ever burn out?	0.0
365711	ef3485e084c3e4785cb6b52d2	Can I work as an inhouse consultant with a TN Visa?	I am working with TN government as an AE and would like to prepare for the UPSC exam. Since I am a probationer I am eligible only for leave on loss of pay. Can I avail leave on loss of pay stating original reason (but I heard if I say the true reason collector will not grant leave)?	0.0
363664	770c3650df660382e12054642	What is the silliest question you have ever read on Quora?	What is the silliest question ever asked?	1.0
80442	fde8f4a1e1202477e22c844f4	What are the main functions of nerve cells?	What is the nerve cell? What are the main functions?	1.0
324726	d28fed39893ee0acae7b6444a	What are some good ways to clean ears?	What is the best way to clean ears?	1.0
267775	0224538191f3975fe24146c9c	Why do Slavs squat?	Is it impressive to squat 135kg/300lb?	0.0
253077	e3c561151e8adbb66e096b65f	What if India and Pakistan went on war today?	What would happen if war were declared between India and Pakistan?	1.0
365074	6bb4302878a7ec1323b6fcd37	What is the definition of virginity and losing your virginity for both males and females?	When and how did you lose your virginity?	0.0
366402	40f263db79084bcb62bc3e83c	How can we measure the height of mountain?	How do they measure the height of a mountain?	1.0
373424	4b40d350816ffecea919b8245	Should students be forced to take AP classes?	Why are students forced to take humanities classes?	0.0
2414	3474491cbcd5ca3974c3c3df8	In the GST bill, what is the meaning of SGST, IGST and CGST when there should be just one kind of tax to be levied?	Will Flipkart return to kerala (with cash on delivery) once the GST bill passed? (just because there won't be any separate sale tax for goods.)	0.0
213761	07c604dcd51c30baf2dd76c00	Are the Pew Research Center's surveys a reliable source?	What is it like to work at the Pew Research Center?	0.0
159126	9c4102ae53555ca3ce2c34c59	Is it true that B positive blood people should not eat groundnuts?	People always say it's useless to eat breakfast after 9 am. Is it true?	0.0
63646	c76b5d5850cd96eaca36b991e	Star Wars (creative franchise): Who would win in a duel: Mace Windu vs Yoda?	Star Wars (creative franchise): Why can't the Jedi detect that Palpatine is a Sith Lord? 	0.0
47088	12c353dec0aa689a835627537	What are the career options after electrical engineering excluding joining the MNCs?	What are career options after B.tech in Electrical engineering?	1.0
133160	48081c5ce42a4b84a0cc10024	"""What are some examples of sentences using the word """"creditable""""?"""	"""What are examples of sentences using the word """"perception""""?"""	0.0
30272	a1cc4d3aee5fbe61ab1cc728d	What is the scope of hospital management in india?	What is the scope of studying hospital management?	0.0
236607	866f9b143b999b9f17571af4c	Why are my lips dry?	How can I make my lips not dry?	1.0
14780	e496dc5ea4b826401fc2cc416	"""Michael Jackson's """"Bad"""" and Prince's """"Purple Rain"""" both sound extremely artificial in terms of sound. How did this not turn listeners off at the time?"""	Why does sound need a medium like air or water in order to travel, but radio waves do not?	0.0
338274	f0b95ecfa4ec59e2f656bb910	Why is Karna so popular among Indian youth when a serious reading of Mahabharata proves him a villain?	Mahabharata (Hindu epic): Why is Karna so overrated?	0.0
226617	0285ffb14df7b16c8b134146e	Who are some people from the Scheduled Caste/Tribe (SC/ST) who can be role models for today's SC/ST youth?	What is Atrocity act for SC/St?	0.0
192466	3246e741b0c5957cee4dae327	The present day Republican parties descended from the democratic party?	Coffee bloom movie?	0.0
94738	03520deeb8e024d254556a288	What type of books should a programmer read for vast knowledge?	Which is the best book to learn programming for beginners and why?	0.0
289750	8cd0d63d2cc6d8fc19fa2799e	What are the disadvantages of the Nokia Lumia 625?	What are the disadvantages of the Nokia Lumia 510?	0.0
391474	ce4804e056d6a240ac0e88233	Can I learn martial arts on my own?	How can I learn martial arts at home through internet?	1.0
69326	e7269a7eb3b1318e4c1ef278c	Why no one in this world is happy?	Who is happy in this world?	0.0
224410	15fb4457292ff13bb1cd8a825	What is the average insurance cost for a 150cc scooter?	What is the average cost of auto insurance?	0.0
365626	a37ee04a3b2ff86661b61eea5	How do I sell my kidney and how much can I get for it? Is it legal?	How much would a kidney go for in the US if there were a free market?	0.0
300859	cf011761769545ed19f30bb95	How should I plan a trip of few days to Goa?	Can you suggest how to plan Goa trip for 4 days?	1.0
398209	ca44d6041dd6d6369d37cdfa6	What is the scope of mechanical engineering around world?	What is the scope of Mechanical Engineering?	1.0
208033	9d567c2c7d2473905e01fa03f	What are your resolutions for 2017? And why?	What would be your New Year resolutions for 2017?	1.0
182610	eb940d4b2561fae0cc17628fd	What are 3–5 life lessons you learned in your 40s you wish you knew in your 30s?	What are 3–5 life lessons you learned in your 50s you wish you knew in your 40s?	0.0
139531	8aceb320c45c786cf64883bc6	How can you attract someone?	How can I not get attracted to someone?	0.0
79267	65bba16b21a2703968e96c5fc	What is the mystery behind Roopkund?	India: What is the mystery behind the Roopkund Lake?	1.0
94510	1c2cf59445eacb42a70373fe7	How will people survive and pay bills in the future when automation replaces all or most jobs?	How will people buy things when automation takes all jobs?	1.0
62811	e648a24cad87fc767c68b262a	What is best way to start learning programming?	What is the best way to start learning programming concepts and skills?	1.0
179448	0a03bd8f2e860eb3974867980	What was the universe before Big Bang?	Before the Big Bang was it in complete darkness?	1.0
261093	4186abd2ac68398b94dc4ce10	What does it feel like to masturbate in a zero gravity environment?	How does fire burn in zero gravity?	0.0
194362	540823083daf70a89cc7f1376	How can I stop eating junk and processed food addiction and stay healthy?	How do I stop my cravings for junk food?	1.0
